text,is_left,is_center,is_right
Olympic swimming champion Cameron van der Burgh said he has been battling the coronavirus for the last two weeks.,1,0,0
The organization named Leung as its new president and chief executive officer on Tuesday as it fights to retain its status as the national governing body for the sport after the Larry Nassar sexual abuse scandal.,1,0,0
"With the Olympic Games postponed until 2021 and cinemas closed across the country, whole segments of the advertising market have evaporated.",1,0,0
"With more than 80,000 reported cases of the disease, the viral outbreak continues to create uncertainty about future competitions, from track and field and Formula 1 to the ultimate global event, the 2020 Tokyo Olympics.",1,0,0
"After days of mounting pressure, the top soccer clubs in Britain said Friday they would ask their players to take a 30 percent pay cut as the sport grapples with the damaging fallout from the coronavirus crisis.",1,0,0
"Some of Europe's biggest clubs, such as FC Barcelona in Spain and Juventus in Italy — two of the hardest-hit countries — have already agreed to hefty wage cuts with their stars.",1,0,0
"Although U.S.-based sporting goods companies now produce almost none of their own gear, increasing the cost of imports from China could still jeopardize thousands of U.S. white collar jobs in design, product development, and sales and marketing.",1,0,0
Jay-Z and the NFL began teaming up as part of a social justice initiative announced last summer in the wake of the controversy over players kneeling during the national anthem to protest racial injustice.,1,0,0
"After spending the past three months rehabilitating from arthroscopic surgery on his right knee, Williamson struggled to find his shot during the first three quarters, during which he played a little less than 12 minutes.",1,0,0
The Brazilian superstar’s career is a testament to what’s possible in women’s soccer — and also a reminder of how little attention the sport still receives.,1,0,0
"Procter and Gamble, a major sponsor of the US Women’s National Soccer team, has backed the players in their fight for equal pay, with a public donation of $529,000.",1,0,0
The disqualification was emblematic of what many women who wear hijabs go through while participating in sports.,1,0,0
"Coach Guerrier adds that the referee’s continued mid-game scrutiny ultimately made “a spectacle” of her daughter, and that he continued to insist that something would have to be done as the child grows up and continues to compete in the sport.",1,0,0
"Athletes and fans are excited for Sowers' historic role at Super Bowl LIV and have remarked that her position is especially poignant given there have only been 13 out gay and bi players in the NFL's 100-year history, according to OutSports.",1,0,0
"Although duties set to kick in soon will affect all manner of sports equipment that hasn’t been made in America for decades, baseball enthusiasts are perhaps affected most because so many items are needed to play the game.",1,0,0
Athletes awoke to news that several water polo players had been injured in a terrifying accident in the early hours of Saturday morning when the second floor of a nightclub came down on the heads of revelers below.,0,1,0
"WADA wants to investigate all the athletes who trained with banned coach Alberto Salazar at the Nike Oregon Project, one of which was Britain’s Farah, the 5,000m and 10,000m champion at both the London 2012 and Rio de Janeiro 2016 Games.",0,1,0
"Big Ten Commissioner Jim Delany told The Athletic last month he was ready to start talking about a larger playoff field, and prominent Big Ten athletic directors Barry Alvarez of Wisconsin and Jim Phillips from Northwestern have voiced support for that idea.",0,1,0
"WADA wants to investigate all the athletes who trained with banned coach Alberto Salazar at the Nike Oregon Project, one of which was Britain’s Farah, the 5,000m and 10,000m champion at both the London 2012 and Rio de Janeiro 2016 Games.",0,1,0
"Women were allowed into Saudi sports stadiums a year ago for the first time to watch soccer matches, although they were segregated in the stands, sticking to the ""family section"" away from all-male crowds elsewhere.",0,1,0
"We’re just a few weeks away from the start of the Olympic torch relay in Greece, which begins with the flame lighting ceremony in Olympia on March 12th – but the outbreak of the novel coronavirus, which continues to spread around the world, has left many wondering whether the 2020 Tokyo Games could be at risk of a postponement or cancellation.",0,1,0
"Big Ten Commissioner Jim Delany told The Athletic last month he was ready to start talking about a larger playoff field, and prominent Big Ten athletic directors Barry Alvarez of Wisconsin and Jim Phillips from Northwestern have voiced support for that idea.",0,1,0
NBA players once again will be sharing personal stories this weekend during All-Star festivities — and using basketball shoes as a platform to get their message out.,0,1,0
"Big Ten Commissioner Jim Delany told The Athletic last month he was ready to start talking about a larger playoff field, and prominent Big Ten athletic directors Barry Alvarez of Wisconsin and Jim Phillips from Northwestern have voiced support for that idea.",0,1,0
Athletes awoke to news that several water polo players had been injured in a terrifying accident in the early hours of Saturday morning when the second floor of a nightclub came down on the heads of revelers below.,0,1,0
"Australian sports stars, sparked in part by a call to action from tennis player Nick Kyrgios, have rallied to raise funds in support of relief and recovery efforts for victims of the country’s bushfire catastrophe.",0,1,0
"The Pro Football Hall of Fame's Centennial class of 2020 is set, and among the 15 honorees selected was former NFL commissioner Paul Tagliabue, who helped lead the league to new heights during his tenure from 1989-2006.",0,1,0
"Yet MLB, with an exhaustive 100+ page health and safety operations manual, will attempt to become the first major sport to return on July 23 with two nationally televised games, and the rest of the teams scheduled to start July 24.\",0,1,0
The National Women’s Hockey League is moving swiftly to expand to Toronto and Montreal after the demise of its Canadian-based rival.,0,1,0
Athletes awoke to news that several water polo players had been injured in a terrifying accident in the early hours of Saturday morning when the second floor of a nightclub came down on the heads of revelers below.,0,1,0
"A 10-hour hearing broadcast on the court’s website showed Sun, China's greatest ever swimmer, and one of its biggest sports stars, to be evasive at times under questioning that was hampered by severe translation issues between Chinese and English.",0,0,1
President of Belarus refuses to cancel sports and scoffs at ‘Psychosis’ of coronavirus measures.,0,0,1
"Andres Iniesta, the former Barcelona captain and World Cup-winning Spanish soccer star, apologized Tuesday after being criticized for posting a picture of him posing with two people clad in blackface during a popular Christian celebration.",0,0,1
President of Belarus refuses to cancel sports and scoffs at ‘Psychosis’ of coronavirus measures.,0,0,1
"The University of Southern California (USC) has fired two employees who allegedly accepted enormous bribes in exchange for facilitating the acceptance of dozens of students, the school has said in an official statement.",0,0,1
U.S. women’s soccer team co-captain Megan Rapinoe is begging prominent male soccer stars to must begin agitating for political causes.,0,0,1
An initiative to build bridges between the Greek and Turkish speaking communities of ethnically split Cyprus faltered after the leader of the breakaway Turkish Cypriots skipped a soccer match over a dispute of the game's location.,0,0,1
"Professional camaraderie between fighters of different races in the sport of boxing is evidence of America moving beyond racial divisions, assessed Randy Gordon, host of SiriusXM’s At the Fights.",0,0,1
"In the wake of the great Bronx injury epidemic of 2019, the Yankees continue to overhaul their people and processes for their training and conditioning.",0,0,1
"Doctors say over-usage of the body in competitive, year-round sports programs is to blame for a rapid rise in major injuries among youth athletes nationwide.",0,0,1
Emilie Kao went on to note that women’s sports has already been undermined by the transgender movement.,0,0,1
Young women taking part in high school and college athletics across the country have had their dreams of winning dashed by the movement to allow biological male who “identify” as female to compete against them.,0,0,1
"The government of the secretive central Asian nation Turkmenistan published photos of what it claimed to be thousands of cyclists celebrating World Health Day on Tuesday with a crowded ride through the nation’s capital, Ashgabat – one of several sporting events seemingly held with no concern for the Chinese coronavirus.",0,0,1
"Omar believes USA Powerlifting is discriminating against males who identify as transgender women, based on the “myth” that they have a “direct competitive advantage” over biological females.",0,0,1
Transgender MMA fighter Fallon Fox twice broke a female opponent’s skull to win matches and now he is being praised by some in the LGBT community.,0,0,1
"Ultimately, the best way to defeat the idea of white supremacy is to ignore cartoon villains like Spencer and Anglin. They’re bigots, losers, and attention-seekers who survive on the oxygen the media gives them.",0,0,1
"While it’s perfectly evident that Trump does have racist supporters (which he is suspiciously reluctant to condemn), many contend that Trumpism is itself not racist, but merely a justified reaction to the Left’s racial patronage.",0,0,1
"Populist eruptions and governments from Brexit to Budapest to President Trump are perceived as confirmation of their fears, necessitating increasingly ferocious efforts to defend liberal democratic pluralism and its virtues of openness, tolerance, and inclusivity.",0,0,1
"Americans generally associate white pride with slavery, segregation, and skinheads. For most of us those are negative associations so, yes, we think it’s creepy to be proud that you’re white.",0,0,1
"Young white men, reacting to social and educational constructs that paint them as the embodiment of historical evil, are fertile ground for white supremacists.",0,0,1
"He has been critical of illegal aliens, but not immigrants in general. Weaver nonetheless implies Trump is somehow responsible.",0,0,1
"A gaggle of representatives from theologically liberal denominations recently issued a statement against Christian nationalism in America, claiming that it threatens both American democracy and the ability of our religious communities to live in peace.",0,0,1
"While it’s perfectly evident that Trump does have racist supporters (which he is suspiciously reluctant to condemn), many contend that Trumpism is itself not racist, but merely a justified reaction to the Left’s racial patronage.",0,0,1
Rep. Steve King’s (R-Iowa) comments on race earlier this month elicited a warranted firestorm of indignation across American politics and media.,0,0,1
"After Steve King’s offensive implication that white people own Western civilization, Chris Hayes predictably responded with an idiotic remark about Western civilization giving us Hitler.",0,0,1
"Many conservatives came to Hawley’s defense, slamming Tapper’s attack on the Missouri senator.",0,0,1
"It is also worth noting that the “white nationalist” in question, Patrick Casey, does not claim to be a white nationalist but an identitarian activist, a group the far-left media regularly attack as racist.",0,0,1
"Among rich lefties, perhaps, this new reality was acceptable, as it dovetailed with their guilt over their own success.",0,0,1
"He has been critical of illegal aliens, but not immigrants in general. Weaver nonetheless implies Trump is somehow responsible.",0,0,1
He then criticized the attempt to lump Republicans and white nationalists into the same group.,0,0,1
"White nationalism-fueled violence is on the rise, but FBI is slow to call it domestic terrorism.",1,0,0
"Coronavirus truthers ignorantly believe that the mainstream media, Democrats, liberals, progressives and Never Trump conservatives have been exaggerating the threat of COVID-19.",1,0,0
He lied about matters large and small. He refused to shake House Speaker Nancy Pelosi's outstretched hand. He talked up a divisive culture war.,1,0,0
"In an age when media stardom apparently confers some kind of universal expertise, it’s probably not a complete surprise that Republican House leaders keep trotting out pundit/provocateur Candace Owens to testify in congressional hearings on what should be a matter requiring the utmost seriousness and gravity: white nationalist terrorism and its toll on the American social fabric.",1,0,0
"In another clip, the group can be seen scrambling for their cars after sirens go off, a newly added security feature.",1,0,0
"The White House did not respond to requests for comment. The White House has defended Miller in previous statements to media, raising Miller’s Jewish background in that defense.",1,0,0
"I'm also struck by Blackburn's style of needlessly toxic politics, once again questioning the patriotism of a decorated U.S. Army combat veteran who earned a Purple Heart.",1,0,0
"Today, the same propaganda is created quickly in the form of digital memes and other media that can be shared widely across the internet, she said.",1,0,0
"South Bend Mayor Pete Buttigieg, a Democratic candidate for president in 2020, called out President Donald Trump for not doing enough to nip white nationalism in the bud, and thereby being partially responsible for mass shootings like the one in El Paso on Saturday.",1,0,0
"But the Christian Right embodies a dangerous form of Christianity that is bitterly anti-science, and its ideology goes hand in hand with white nationalism and the coronavirus truther movement.",1,0,0
Facebook is banning white nationalism and white supremacy from its social network following criticism that it had not done enough to eliminate hate speech on its platform.,1,0,0
"As shocking as it is, even the terrorists of ISIS have been shown for respect for science when it comes to COVID-19 than the Christian Right, American white nationalists and coronavirus truthers. And the more the Christian Right rails against Fauci and social distancing, the more painfully obvious it becomes that they are a white nationalist death cult.",1,0,0
"But the Christian Right embodies a dangerous form of Christianity that is bitterly anti-science, and its ideology goes hand in hand with white nationalism and the coronavirus truther movement.",1,0,0
"The SPLC last year released hundreds of emails of Stephen Miller,the architect of Trump’s immigration policies such as the child-parent separations at the border and the Muslim ban, in which he cited and promoted ""explicitly white nationalist websites.""",1,0,0
"Backlash against marginalized communities doesn’t surprise University of Southern California Professor Chris Freeman, whose work primarily focuses on 20th century gay and lesbian studies.",1,0,0
"While emphasizing he’s not singling out either party, Cohen warned about the danger of normalizing white supremacist ideology.",0,1,0
Federal prosecutors charged a 26-year-old U.S. Army veteran who they say expressed support for the Islamic State with plotting to bomb a local white nationalists rally.,0,1,0
An avowed white supremacist pleaded guilty on Monday for planning bomb and shooting attacks at a synagogue and LGBTQ bar in Las Vegas. ,0,1,0
"Two years ago, America’s white nationalist movement stunned the country. Neo-Nazi demonstrations in Charlottesville, Virginia, had turned deadly when a far-right protester drove a car through a crowd, killing one and injuring dozens.",0,1,0
"Colin P. Clarke has been teaching a course on terrorism and insurgency at Carnegie Mellon University in Pittsburgh for four years, and much more of his class these days is devoted to white supremacy than in the past.",0,1,0
The “OK” hand gesture is among the 36 new entries added Thursday to a database of hate symbols used by white supremacists and other far-right extremists.,0,1,0
"While emphasizing he’s not singling out either party, Cohen warned about the danger of normalizing white supremacist ideology.",0,1,0
"John William King, 44, a white supremacist who orchestrated the attack, is the second man to be executed in one of the most gruesome hate crimes in modern U.S. history.",0,1,0
"In the wake of the El Paso shooting, in which 22 were killed and 24 injured, the discovery of a racist manifesto that may be linked to the shooter has pushed white supremacist ideologies into prominence.",0,1,0
A review of his posts in online message boards revealed he wanted to plant neo-Nazi propaganda inside Nevada middle and high schools.,0,1,0
"In the wake of the El Paso shooting, in which 22 were killed and 24 injured, the discovery of a racist manifesto that may be linked to the shooter has pushed white supremacist ideologies into prominence.",0,1,0
The El Paso attack has also put new pressure on a man some white nationalists praise as helping advance their movement: Donald Trump.,0,1,0
"The ADL report represents a sobering warning about the reach of white supremacist groups, which can take advantage of the efficiency and anonymity provided by social media to disseminate their ideology with little fear of backlash.",0,1,0
"John William King, 44, a white supremacist who orchestrated the attack, is the second man to be executed in one of the most gruesome hate crimes in modern U.S. history.",0,1,0
"The normalization effort included softened rhetoric and social gatherings that, for many groups, would increasingly replace confrontational rallies.",0,1,0
Phoenix’s Oscar speech for Joker was a rambling discourse that veered in several direction before settling on environmental platitudes.,0,0,1
"The Guardian, insisting that the climate emergency is “the defining issue of our times,” has amped up its climate agitation by suggesting that Australian wildfires is the new normal.
",0,0,1
"Climate change, which is the subject of fierce debate, may lead to a ""substantial increase"" in the number of extreme rainstorms, according to a startling new study by NASA.",0,0,1
"But the elimination of air travel strikes particularly close to the homes of Sens. Kirsten Gillibrand, Cory Booker, Bernie Sanders, and Kamala Harris – all of whom extensively used air travel, including private jets – throughout the years in office.",0,0,1
Climate Wunderkind Greta Thunberg has garnered gushing praise from celebrities during her environmental crusade.,0,0,1
President Donald Trump used the occasion to again voice skepticism about climate change.,0,0,1
"A shocking new study says that the ice in the Arctic Ocean will disappear by 2050, which could have ""substantial"" implications on the ecosystem and the climate in the region.",0,0,1
"The American Petroleum Institute's (API's) estimates were released two days before South Carolina's Democratic primary, where the candidates will compete with platforms that push aggressive agendas on energy and the environment.",0,0,1
"CNN anchor Chris Cuomo was quick to defend climate activist Greta Thunberg from ""Trumpers"" who mocked her on Thursday but was quickly reminded about the settlement his network recently made with Covington Catholic High School student Nick Sandmann.",0,0,1
"While these many similarities between Green New Deal and the constitution ushered in by Venezuelan leftist dictator Hugo Chavez in 1999 may be just happenstance, the important thing to remember is that Venezuela under its new constitution has become a disaster zone.",0,0,1
"Although he didn’t seem to direct his comments at anyone in particular, many celebrities that consider themselves climate change activists have not adjusted their lifestyles of taking private jets to their engagements around the globe, for example, Leonardo DiCaprio, Katy Perry and Orlando Bloom all took heat in 2019 when they were among the A-listers to attend Google’s climate change conference by way of private jets and mega yachts.",0,0,1
"Top Democrats running for president in 2020 have jumped on and endorsed Democratic Socialist Alexandria Ocasio-Cortez’s radical Green New Deal that aims, among other things, to eliminate air travel.",0,0,1
Greenpeace co-founder and former president of Greenpeace Canada Patrick Moore explained to Breitbart News how Greenpeace’s original spirit of celebrating humanity was usurped by an anti-human Malthusian vision.,0,0,1
"After years of openly struggling with her weight (and health) and a seemingly self-imposed sabbatical from political lectures after backing Hillary Clinton in ’16, actress Lena Dunham announced to the world that it was Joaquin Phoenix’s unhinged Oscars tirade on the environment that has made her want to become vegan.",0,0,1
"Like the costly and controversial Green New Deal, which Booker co-sponsored in the form of a Senate resolution, Booker’s plan aims to address both climate change and economic inequality.",0,0,1
"Things look less promising in the U.S. Last week, the Environmental Protection Agency confirmed that the Trump administration had relaxed enforcement of regulations to help polluting industries deal with the pandemic.",1,0,0
The sharp reductions documented in carbon emissions and air pollution caused by coronavirus-related lockdowns have offered a sort of preview of the kind of improvements that can be made when drastic action is taken.,1,0,0
"In practice, that means it's hard to trust Bezos' pledge when Amazon, the source of his wealth, has been aggressively courting oil and gas companies with its cloud computing services and threatened workers who campaigned for stronger climate action with dismissal. ",1,0,0
"After witnessing the right-wing reaction to Greta Thunberg, the teenage climate activist from Sweden who spoke at the United Nations this week, there can be no doubt that modern-day conservatism, especially the Republican Party, functions primarily as a protection racket for the fragile egos of mediocre white men. ",1,0,0
"Threre are some concerns about whether some of the goals set by the Green New Deal are realistic, but to argue that the blueprint is genocidal is hopelessly bonkers.",1,0,0
"Since 2016, climate scientists have been revising their estimates of the pace and severity of climate change, and the problem today looks more severe than their worst-case scenarios from three years ago.",1,0,0
"Their work came on the heels of an IPCC report that warned of dire environmental, economic and health consequences in the absence of any serious momentum toward decarbonization by 2030.",1,0,0
"Almost all of this is gibberish; Trump still can’t speak coherently about California’s wildfires; and no officials in the Golden State ever conceded that he was “right” about the subject, because he wasn’t.",1,0,0
"Derrick Morgan, senior vice president for federal and regulatory affairs for oil lobby group American Fuel & Petrochemical Manufacturers (AFRM), bragged about how successful the industry has been in pushing anti-protest legislation,",1,0,0
"The result was a mess: car manufacturers, which had already begun taking steps to comply with the Obama-era tough fuel-efficiency standards for the auto industry, faced the prospect of having to make different vehicles to sell in different parts of the country.",1,0,0
The sharp reductions documented in carbon emissions and air pollution caused by coronavirus-related lockdowns have offered a sort of preview of the kind of improvements that can be made when drastic action is taken.,1,0,0
"Indeed, just this week, Donald Trump, who once said the climate crisis was a hoax concocted by the Chinese, marveled at cold temperatures throughout the Midwest, convinced that the frigid weather is evidence of … something.",1,0,0
"Rep. Alexandria Ocasio-Cortez (D-NY) has been an avid supporter of the “Green New Deal,” a plan that would take dramatic steps to curb the United States’ contribution to global climate change. ",1,0,0
"In Washington, three key issues seemed to galvanize most of the protesters: climate change, immigration and reproductive rights.",1,0,0
"By any sensible measure, the Trump administration is among the worst ever seen for respecting, valuing, and following science.",1,0,0
"On Wednesday, democrats got a chance to grill President Donald Trump's point person on deregulation as Andrew Wheeler came to Capitol Hill for his confirmation hearing to be the next permanent administrator of the Environmental Protection Agency.",0,1,0
"The Utah Republican Sen. Mike Lee honed his inner troll while using everything from posters showing Aquaman and Star Wars characters to quotes from Austin Powers to paint the Green New Deal bill as ""ridiculous"" and something that would never pass in Congress and never work. ",0,1,0
"For the first time the annual risk report, compiled by the World Economic Forum (WEF), found the top five concerns were all environmental, from extreme weather to biodiversity loss and events like oil spills and radioactive contamination.",0,1,0
"The oil price crash has led to Danish offshore wind developer Orsted overtaking Norwegian oil major Equinor as the most valuable energy company in the Nordics, highlighting the appeal to investors of renewables over fossil fuels.",0,1,0
