text,is_left,is_center,is_right
"This includes children that officials have stolen from their families, done so with full knowledge that family separation and detention cause long-term harm to children, and done so with the fact that for the first time in years, migrant kids have died under U.S. watch.",1,0,0
Inhibiting travel and commerce—not to mention making consular interviews deeply intrusive on a gendered basis—by imposing restrictions on pregnant women is an alarmist reaction to a small issue.,1,0,0
"Donald Trump appeared to make some important news via Twitter last night, announcing a dramatic new plan to use Immigration and Customs Enforcement (ICE) agents to remove “millions” of people from American soil.",1,0,0
A Guatemalan mom who says she sustained severe chemical burns and was sexually assaulted in front of her young daughter during a kidnapping in Mexico is asking the U.S. government to let her into the country while her asylum case plays out.,1,0,0
"The travel ban would not have prevented the country’s deadliest terrorist attacks in recent years, which were committed by right-wing Americans, not immigrants: the anti-immigrant extremist who killed 22 shoppers at a store in El Paso; the white supremacist who killed 17 students and teachers at a school in Parkland, Florida; or the anti-Semite who killed 11 worshipers at a synagogue in Pittsburgh.",1,0,0
"The Democratic candidates predictably criticized the worst Trump administration immigration policies, such as families separated at the border and chronic uncertainty for undocumented people in the U.S., many of whom arrived decades ago as children.",1,0,0
"While President Donald Trump’s impeachment trial had been wrapping up, he expanded one of his most controversial and inflammatory policies with little fanfare and minimal opposition: the travel ban on people from multiple Muslim-majority countries.",1,0,0
One of the most common canards against immigration is the idea that illegal immigrants drive down the wages for native workers.,1,0,0
Critics of the Trump administration’s immigration policies have said such policies violate migrants’ rights and further endanger them by making them wait in dangerous border towns or in one of the most violent countries in the world lacking robust asylum systems.,1,0,0
"Democrats really don’t want to spend billions of taxpayer dollars on a giant, ineffective border wall, so if Trump were try to come up with an offer designed to entice them, he’d have to propose something that would be (a) enormous; and (b) wildly unpopular among Republicans.",1,0,0
"For most of his presidency, the Republican has demanded sharp cuts to legal immigration, and has made this a non-negotiable element of any deal.",1,0,0
"Donald Trump’s presidential campaign and many of his administration’s policies have played on the trope of threats posed by refugees, asylum seekers and other migrants.",1,0,0
Ingraham began the exchange by noting American graduates’ salaries have been suppressed by the flood of foreign graduates.,0,0,1
"But Sanders’ growing popularity – even after expressing sympathetic views of Castro and other authoritarian regimes – underscores a problem for Florida Democrats, especially in South Florida, which has a large number of Cubans, Venezuelans and Nicaraguans whose families suffered under dictators.",0,0,1
"An unidentified Mexican asylum-seeker took his own life Wednesday just yards from the U.S. border after he was denied entry, a report said.",0,0,1
Six Republican Senators have failed to develop a coalition for their plan that exchanges a fifth of border wall funding for an amnesty for illegal aliens and increased immigration.,0,0,1
"President Donald Trump surprised reporters at the White House briefing room on Thursday, continuing his demand for wall funding.",0,0,1
"Remittances from the three Central Americans countries are being spiked by the growing inflow of asylum-seeking migrants into blue-collar jobs throughout the U.S. economy, via the border’s catch-and-release laws.",0,0,1
Rep. Alexandria Ocasio-Cortez (D-NY) on Tuesday blasted President Donald Trump’s border wall as a “monument to hate” and a “monument to himself.”,0,0,1
"A report by the United Nations (UN) falsely blamed President Trump for the detention of 100,000 migrant children who, in fact, were held in federal immigration custody in 2015 by President Obama.",0,0,1
"After that phone call, police asked the couple to come in for questioning, prompting them to flee Saudi Arabia, a country long known for draconian laws against homosexuality.",0,0,1
"Rep. Alexandria Ocasio-Cortez, D-N.Y., has taken another shot at President Trump amid their ongoing feud, saying he cannot conceive of an immigration system that didn't involve torture or hurting innocent people.",0,0,1
"As people sip cafecito and eat croquetas at the landmark restaurant, the buzz here these days is what Cubans say is the alarming rise of Democratic presidential frontrunner Sen. Bernie Sanders, whose unabashed defense of late Cuban dictator Fidel Castro has riled Cuban-Americans who view his comments as a personal attack.",0,0,1
Many of the U.S. Border Patrol agents on the front lines of the U.S. effort to secure the southern border with Mexico bristle at what they see as public misconceptions and media mischaracterization of their work.,0,0,1
"In July 2019, Rep. Alexandria Ocasio-Cortez, D-N.Y., and other Democrats visited a similar processing center in Clint, Texas, and made explosive allegations about the conditions there.",0,0,1
"As Breitbart News most recently reported, blue-collar Americans in landscaping, conservation work, the meatpacking industry, construction industry, and fishing jobs have had their wages dragged down by foreign workers imported through the H-2B visa program.",0,0,1
"Democrats this week approved legislation to require background checks for essentially all sales and transfers of firearms -- but rejected GOP-led efforts to amend the legislation to alert law enforcement authorities when gun buyers, including illegals, fail those background checks.",0,0,1
"Thousands of asylum seekers crammed in border towns near the Texas-Mexico border awaiting U.S. immigration hearings are at risk of dying from coronavirus because of poor health access and unsafe conditions, advocates say.",0,1,0
U.S. President Donald Trump said on Thursday he was likely to declare a national emergency to secure funds for his long-sought wall along the U.S. southern border if he cannot reach an agreement with Congress to provide the money.,0,1,0
"People from populations targeted by these immigration policies might also experience more discrimination, which worsens mental health.",0,1,0
"A humanitarian ship that has had about 230 rescued migrants on board for almost a week will enter a Maltese port on Wednesday, ending a standoff with Italy which refused to let the ship dock.",0,1,0
"Hungarian Prime Minister Viktor Orban, a staunch anti-immigrant populist, said on Wednesday a new wave of migrants trying to cross the border from Turkey into the European Union must be stopped as far south as possible and his government was ready to help frontline Greece.",0,1,0
"Mexico said on Monday it would reject a U.S. idea to take in all Central American asylum seekers if it is raised at talks this week with the Trump administration, which has threatened to impose tariffs if Mexico does not crack down on illegal immigration.",0,1,0
"Velasquez, 27, is among the nearly 700,000 undocumented young people who were brought to the USA as children and rely on the Deferred Action for Childhood Arrivals program, or DACA, that President Donald Trump wants to terminate.",0,1,0
"Friday, a legal services organization at Yale Law School sent a letter to the high court urging that the administration's decision to terminate DACA should be blocked in light of the pandemic.",0,1,0
"Her plight, along with those of about 27,000 DACA recipients working as doctors, nurses, paramedics and other health care workers, is full of irony: when the nation needs her most, she could be pulled from the workforce.",0,1,0
"Mexico said on Monday it would reject a U.S. idea to take in all Central American asylum seekers if it is raised at talks this week with the Trump administration, which has threatened to impose tariffs if Mexico does not crack down on illegal immigration.",0,1,0
"Under current immigration policies, it’s possible that immigration arrests could lead to poor mental health by increasing deportation fears among undocumented individuals and their families and neighbors, the study authors write.",0,1,0
"People from populations targeted by these immigration policies might also experience more discrimination, which worsens mental health.",0,1,0
"After the airstrike that killed Iranian Gen. Qasem Soleimani, there were reports that U.S. Customs and Border Patrol detained dozens of people at the Blaine, Washington, port of entry over the weekend.",0,1,0
"Trump said he will visit the U.S.-Mexican border Thursday to promote his plan for a wall to keep out undocumented immigrants, the sticking point in negotiations with Democrats to reopen the government.",0,1,0
"A humanitarian ship that has had about 230 rescued migrants on board for almost a week will enter a Maltese port on Wednesday, ending a standoff with Italy which refused to let the ship dock.",0,1,0
Students across India on Tuesday stood in solidarity against a vicious weekend attack on a prestigious New Delhi university by masked men wielding sticks that led to 40 students and staff being sent to the hospital.,0,0,1
"Haqqani claimed the Taliban are just looking for a round of free and fair elections, laughably pretending the murderous Islamist extremists would cheerfully accept losing and head back to their caves in peace if the Afghan people reject them.",0,0,1
"American manufacturing jobs have boomed to a more than 20-year high as President Trump has imposed a wide range of tariffs on imported steel, aluminum, and Chinese products — dooming predictions made by free traders that have yet to pan out.",0,0,1
"On Friday, Trump said he remained ready to help South Korea and Japan solve their lingering dispute over World War II-era forced labor that has blighted their trade ties.",0,0,1
"The U.S. manufacturing jobs boom comes as free trade economists, billionaire donors, and establishment media pundits have routinely claimed that Trump’s 25 percent tariff on imported steel and ten percent tariff on aluminum would cripple the American economy.",0,0,1
This would be the same Taliban that gleefully murders young women for the crime of going to school and regards democracy as a crime against Islam punishable by death.,0,0,1
The demonstrators were protesting against Japanese Prime Minister Abe Shinzo’s trade restrictions against South Korea and spotlighting the century-old dispute over Imperial Japan’s use of forced labor in Korea that underlies the current economic and diplomatic crisis.,0,0,1
"Everywhere he went on Monday, Trump was greeted by thousands of cheering Indian citizens, troops of traditional dancers and roadways lined with posters and billboards celebrating his visit.",0,0,1
"Save the Children made several recommendations addressed to governments and armed groups to ensure the protection of children, urging them to commit themselves not to recruit fighters under 18 years of age and to avoid the use of explosive weapons in populated areas.",0,0,1
"Everywhere he went on Monday, Trump was greeted by thousands of cheering Indian citizens, troops of traditional dancers and roadways lined with posters and billboards celebrating his visit.",0,0,1
The deputy commissioner of Kolkata Police eventually apologized for the bloodying of students - many of whom were women - and argued that tensions had risen too quickly. ,0,0,1
"On Friday, Trump said he remained ready to help South Korea and Japan solve their lingering dispute over World War II-era forced labor that has blighted their trade ties.",0,0,1
"China is watching Japan-South Korea conflict carefully, nervous about the regional economic disruption but perhaps seeing an opportunity to isolate Japan and build stronger ties with South Korea.",0,0,1
Ankara launched a cross-border attack against Syria’s Kurds on October 9 after the United States announced a military pullout from the north of the war-torn country.,0,0,1
"China is watching Japan-South Korea conflict carefully, nervous about the regional economic disruption but perhaps seeing an opportunity to isolate Japan and build stronger ties with South Korea.",0,0,1
"India’s Prime Minister Narendra Modi is often compared to Donald Trump, especially when it comes to his anti-Muslim policies.",1,0,0
"India’s Prime Minister Narendra Modi is often compared to Donald Trump, especially when it comes to his anti-Muslim policies.",1,0,0
Peace and justice advocates are praising a letter from a dozen House Democrats urging further military aid to Israel be conditioned on the state not annexing larger swaths of the occupied West Bank and calling on Congress to ensure the human rights of the Palestinian people be respected.,1,0,0
"On Friday, Trump claimed he had reached a landmark last-minute immigration deal with Mexico, which meant he no longer had to impose the tariffs he had been threatening, part of his incoherent southern-border policy.",1,0,0
"The targeted killing is the latest demonstration of how, two decades after the CIA spotted but was unable to kill a man they believed was al Qaeda leader Osama bin Laden in Afghanistan, the U.S. has become adept at hunting and killing its enemies, particularly in the troubled regions of the Middle East, South Asia and Africa.",1,0,0
Peace and justice advocates are praising a letter from a dozen House Democrats urging further military aid to Israel be conditioned on the state not annexing larger swaths of the occupied West Bank and calling on Congress to ensure the human rights of the Palestinian people be respected.,1,0,0
"Now Modi has made international headlines for yet another similarity: He’s constructing a massive wall … but unlike Trump’s goal of keeping immigrants out, Modi’s wall was built to hide the country’s poverty from the gold-plated American president.",1,0,0
"Given the potential enormous risks of destabilizing the region, the Trump administration needed a strong justification for launching the strike that killed revered Iranian military leader Qassim Suleimani.",1,0,0
"President Donald Trump has been doubling down on his love of tariffs this week, vowing to increase tariffs on Chinese imports.",1,0,0
"The leader of India, Prime Minister Narendra Modi, has been groomed by the right-wing, xenophobic and Islamophobic Rashtriya Swayamsevak Sangh (RSS) along with its polticial arm, the Bharatiya Janata Party (BJP).",1,0,0
"At around 10 a.m., however, Trump sent out a tweet that explicitly warned Israel against letting Rep. Omar and Rep. Tlaib in.",1,0,0
Iowa farmers are bearing the brunt of the U.S. trade war with China as Donald Trump continues to threaten increased tariffs on Chinese imports.,1,0,0
Fears of an all-out war between the United States and Iran escalated earlier this month following the killing of Iranian military commander Qasem Soleimani by U.S. forces.,1,0,0
"Using the International Holocaust Remembrance Alliance's definition of anti-Semitism, Canada’s vote for creation of a Palestinian state does not delegitimize Israel, any more than Canadian criticism of any other state delegitimizes it.",1,0,0
"Now Modi has made international headlines for yet another similarity: He’s constructing a massive wall … but unlike Trump’s goal of keeping immigrants out, Modi’s wall was built to hide the country’s poverty from the gold-plated American president.",1,0,0
"A former North Korean diplomat who staged a high-profile defection to the South on Saturday urged an old colleague who has gone missing in Italy to defect to Seoul, following a report that he was seeking asylum in the United States.",0,1,0
"Trump's decision to remove the troops near the Turkish border has allowed Turkey to lodge an attack on U.S. Kurdish allies who helped in the fight against the Islamic State terrorist group, also known as ISIS.",0,1,0
Other European countries have also said they will strip dual nationals who joined Islamic State of citizenship.,0,1,0
"Russia killed civilians in air strikes in Syria last year while rebels allied to Turkey carried out murder and pillage in Kurdish areas, U.N. investigators said on Monday - actions it said could amount to war crimes by both Moscow and Ankara.",0,1,0
In the past Putin has warmly welcomed home Russian agents arrested abroad.,0,1,0
"That response, Americans would learn days later, would include a move widely seen as escalating aggression in the region rather than alleviating it: A U.S. drone strike targeting Iranian Major General Qasem Soleimani, the second most powerful leader in Iran and commander of the Quds Force of the Islamic Revolutionary Guard Corps.",0,1,0
"Putin, who has aligned himself with the Russian Orthodox Church and sought to distance Russia from liberal Western values, has proposed a shake-up of Russia’s political system that critics say may be designed to extend his grip on power after 2024, when he is due to leave the Kremlin.",0,1,0
"After threatening Iran in a series of tweets hours earlier, Trump seemed eager to lower tensions.",0,1,0
"After threatening Iran in a series of tweets hours earlier, Trump seemed eager to lower tensions.",0,1,0
"Convicted Russian agent Maria Butina was released from a Florida prison on Friday after serving most of her 18-month sentence for conspiring to influence U.S. conservative activists and infiltrate a powerful gun rights group, and taken into custody by immigration officials to be deported to her native country.",0,1,0
"A former North Korean diplomat who staged a high-profile defection to the South on Saturday urged an old colleague who has gone missing in Italy to defect to Seoul, following a report that he was seeking asylum in the United States.",0,1,0
"Putin, who has aligned himself with the Russian Orthodox Church and sought to distance Russia from liberal Western values, has proposed a shake-up of Russia’s political system that critics say may be designed to extend his grip on power after 2024, when he is due to leave the Kremlin.",0,1,0
"Top Trump administration officials told lawmakers Tuesday that U.S. military deployments in the Middle East were purely defensive and not aimed at provoking a war with Iran, amid growing concerns in Congress about a possible military conflict.",0,1,0
"Paul Whelan, the former U.S. Marine held in Moscow on spying charges, had online contact with more than 20 Russians with military backgrounds, an analysis of social media shows.",0,1,0
"U.S. intelligence assessments and experts have said that Saudi Crown Prince Mohammed bin Salman, who controls all levers of power in Saudi Arabia, likely ordered or at least knew about the killing of Washington Post columnist Jamal Khashoggi.",0,1,0
"The whiteness of the protests alongside the stark racial disparities in COVID-19 mortality underscores that the desire to reopen businesses is rooted in white supremacy. As if it weren’t already clear, in Michigan where the nation’s most prominent protest took place, armed white men demanded an end to the lockdown while carrying Confederate flags, swastikas, and nooses.",1,0,0
"Of course, viruses don’t just “go away” regardless of the amount of propaganda or wishful thinking you throw at them. His theory, however, is telling. Trump’s strategy from the beginning of this crisis has been to minimize the threat and wish it away.",1,0,0
"Earlier, the Welt am Sonntag German newspaper reported that President Donald Trump had offered funds to lure CureVac to the United States",1,0,0
"While Pence and the president have tried to paint a rosier picture of the virus and project a return to normalcy, some members of the task force are eager to resume appearances from White House grounds",1,0,0
"During that address, Lindell, a former drug addict turned born-again Christian who has donated more than $200,000 to Trump’s election efforts, went off-script, proclaiming to the nation that Trump had been “chosen by God.”",1,0,0
"During a nationally-televised press briefing President Donald Trump suggested doctors and scientists should test the “injection” of disinfectants, like bleach or alcohol, into the human body as a way to cure coronavirus.",1,0,0
"But behind the scenes, Trump was getting briefings. Terrible briefings. Really awful stuff. His own campaign manager, Brad Parscale, who was reported to have spent his hefty paycheck from the Trump campaign on condos, a luxury boat and a Ferrari, met with him and showed him his internal poll numbers.",1,0,0
"A second patient, a 58-year-old obese woman with diabetes and arterial hypertension, suffered multi-organ failure and eventually died of a cardiac arrest. According to the authors of the Lancet article, they discovered “lymphocytic endotheliitis in lung, heart, kidney, and liver as well as liver cell necrosis.",1,0,0
President Donald Trump’s younger adult son is being criticized for falsely claiming on national television that the COVID-19  crisis is a Democratic hoax that will “disappear” after the November presidential election.,1,0,0
"Reports of Americans misusing bleach and other disinfectants quickly flooded the news, as hospital emergency rooms saw spikes in bleach exposure and other similar poisonings. When confronted with the news of people misusing bleach, Trump refused to take any responsibility.",1,0,0
"It's not just governments and international organizations that have lined up to express dismay at Trump's move. Experts, entrepreneurs and others have also been quick to condemn the announcement.",1,0,0
"The utter failure of private capitalism to prepare for the coronavirus should have surprised no one. Private capitalism, as business school graduates repeat, focuses on profit. The “profit incentive,” they learn, makes private capitalism the superior, “most efficient” economic system available.",1,0,0
"Remarkably, the first three years of Trump’s presidency were relatively smooth sailing outside of self-inflicted crimes and mishaps. His actual approach to life was never fully tested in the Oval Office. Now, with the first real challenge of his presidency, he is utterly adrift.",1,0,0
Coronavirus: E.U. blasts Trump's travel ban as it unleashes chaos and confusion.,1,0,0
"This is another example of Trump’s false dichotomy between saving the economy and fighting the virus. After all, the economy isn’t going to recover if millions are sick and people are afraid to leave their houses — and early evidence from the states that have tried to “reopen” their economies makes that clear.",1,0,0
"Outraged Democrats vowed to appeal a federal judge’s ruling that could undo the US health care law known as Obamacare, saying on Saturday that they will use their new power in Congress to hold Republicans responsible and “expose their lies.”",0,0,1
"By forcing us to abandon our regular routines and habits, if not our livelihoods, the pandemic has led us to postpone many of the activities from which we derive joy and pleasure. Our society often operates under the premise of instant gratification, a concept that has gone out the window given the uncertainty surrounding the virus.",0,0,1
"The outbreak, which began in the Chinese city of Wuhan, has wreaked devastation on the global economy and threatens to plunge hundreds of millions of people into poverty.",0,0,1
"House Speaker Nancy Pelosi debuted a 1,120-page coronavirus rescue bill after Democrats tanked the Senate proposal on Sunday night.",0,0,1
"While Pace receives her spiritual grace from a Christian God, science has shown that faith in a supernatural wonder, whatever it may be, that bears powerful benefits on an individual’s mental and even physical well-being.",0,0,1
AP Confirms: Democrats Are Lying to the Public About Coronavirus Readiness...,0,0,1
We did consent to the lockdowns and now are suffering under the insanity that has flowed from them—economic suicide and petty local laws that serve no purpose other than to nanny us into submission.,0,0,1
DeSantis was initially tentative to shut down outdoor recreational areas like beaches and was ridiculed by the media for his allegedly relaxed response.,0,0,1
"If China’s actions in the coronavirus catastrophe offer any window into this communist regime’s machinations, deceitfulness, and debasement of human life, it is that the threat they represent is unlike anything America has faced.",0,0,1
"Cuomo has been championed by the mainstream media for his response to the coronavirus pandemic in New York City, but his state-wide response to nursing homes deserves anything but the glowing praise he’s received.",0,0,1
Democrats blocked a coronavirus package on Sunday that would provide economic relief to businesses and Americans suffering from the impact of the coronavirus outbreak,0,0,1
"The Democrats’ bill is a massive giveaway to Silicon Valley, to tech donors, and to many Fortune 500 companies in the banking and insurance industries who have replaced their American graduates with blocs of imported Indian and Chinese workers.",0,0,1
"Alex Berenson, a former reporter at the New York Times who has written extensively debunking fearmongering claims related to the lockdowns wrote on Twitter Thursday that the tech giant to benefit the most from pandemic stay-home orders is refused to sell his latest book.",0,0,1
