text,is_left,is_center,is_right
"After all, not only was the intrepid, all-controlling/all-seeing hero of their meta-theory—Donald Trump—roundly defeated at the polls, but the anonymous persona at the center of the cult has dropped from sight.",1,0,0
"Republican Rep. Clay Higgins of Louisiana has a long and colorful track record of being a right-wing prick who has a strange preoccupation with World War II, though which side he’s most obsessed with remains debatable.",1,0,0
"Donald Trump, the latest political demagogue to employ the term as a rhetorical bludgeon against peaceful protesters, can look forward to sitting alongside Sen. Joseph McCarthy, former Alabama Gov. George Wallace, Chicago Mayor Richard J. Daley, who ordered police to attack political demonstrators at the 1968 Democratic convention, Richard Nixon and many foreign dictators in the annals of history — and if there is an afterlife, in the middle of the inferno.",1,0,0
"In a country where gun ownership and firearms training are seen by the far right as inalienable, all-American freedoms, the military is a ripe breeding ground for disaffected men looking for individual empowerment, a sense of belonging, and just such training.",1,0,0
"This redefinition of aggression has been going on for decades on the American right, fueled in large part by the NRA and the gun industry. ",1,0,0
"In his defense, Trump and his supporters have claimed that not all the protesters were peaceful, and that there were criminals among them. ",1,0,0
"How do the people at these rallies make sense of their claims that they are not ""racist""  or ""violent"" while they are carrying guns, waving Confederate flags, wearing other fascist insignia and in several cases displaying signs with Nazi slogans?",1,0,0
White mobs have once again moved out of the shadows and into the limelight during this Trump moment.,1,0,0
No sooner do states start getting together to talk about what it would take to start a rolling economic re-opening than here comes Donald Trump to assert that only he has that authority.,1,0,0
Rap superstar Kanye West has hinted at postponing his bid for the U.S. presidency after questioning whether all black people should be voting for Democratic nominee Joe Biden.,0,0,1
"Regardless of the chatter and ongoing analysis from political pundits, commentators, and officials, Harris has a well-documented record of embracing radical progressive ideas, touting them herself on numerous occasions.",0,0,1
Democrat presidential hopeful and gun control proponent Joe Biden has officially chosen extreme gun controller Kamala Harris to be his running mate.,0,0,1
"This Tuesday, the French celebrated Bastille Day, the mob attack on a Parisian prison that has come to symbolize the French Revolution, a period of massive violence that produced nothing other than a lot of dead Frenchmen. ",0,0,1
He was shot in front of his Flatbush apartment on Ocean Avenue Friday afternoon at 4 p.m.,0,0,1
Kemp also alleged in his lawsuit that Bottoms has forbidden police from enforcing Kemp’s earlier orders against gatherings of more than 50 people.,0,0,1
"Instead of challenging the smears that America is a racist country, instead of standing up for police officers and the rule of law, even the Republican Party is taking a knee, is looking to appease, is acting as Black Lives Matter-lite with their stupid and completely unnecessary police reform ideas.",0,0,1
"The wave of violence started as protests against the death of George Floyd, a black man who died in May at the hands of police in Minneapolis, and quickly devolved into mob rule in cities across America.",0,0,1
"Doubling down, Rapaport — a raging left-wing Trump hater — tweeted “Singing slave owners.”",0,0,1
"Watching a crazed mob tear down the statue of Christopher Columbus in Pelosi’s native Baltimore on July 4, it was impossible to believe an earlier generation of Democratic leaders would have allowed such destruction.",0,0,1
"He mourned the dead, touted his gun control and education proposals, and that was it.",0,0,1
"Also, Biden told a New Hampshire audience in February that PLCAA gave gun makers “a loophole that does not allow them to be sued for the carnage they are creating,” Breitbart News reported.",0,0,1
"Won’t it be absurdly difficult to enforce new gun-control laws, or move toward the outright confiscation that is always and forever the Left’s ultimate goal, after a year of record-breaking gun sales?",0,0,1
Rocker Jon Bon Jovi has released a new single titled “American Reckoning” about the death of George Floyd in Minneapolis.,0,0,1
"More than two dozen shootings across New York City over the weekend left a one-year-old dead and at least 34 others injured, some potentially fatally, dwarfing the number of people killed there by the coronavirus during the same period.",0,0,1
"Warren last year introduced a proposal that would eliminate up to $50,000 in student loan debt for every indebted person with a household income of less than $100,000. ",0,1,0
"The 2010s saw the U.S. economy achieve its longest-ever expansion, with notable milestones such as 110 months of uninterrupted job gains and an unemployment rate near a half-century low becoming easy bragging points for politicians and economists alike.",0,1,0
"Opposition Labour Party leader Jeremy Corbyn said on Thursday he would look at ways to help those who have already incurred large debts from university tuition fees, and would not sell off student loans to private companies.",0,1,0
Sen. Elizabeth Warren would capitalize on the federal government's current legal authority and begin canceling existing student loan debt on her hypothetical first day in office.,0,1,0
The defendants did not admit or deny wrongdoing. Their lawyer did not immediately respond to a request for comment. The settlement requires court approval.,0,1,0
"New York’s attorney general said on Friday she has settled a lawsuit against three companies accused of tricking struggling borrowers into paying more than $1,000 for student loan debt relief services that were available for free.",0,1,0
"When parents borrow, the debt can weigh down families for generations but the burden falls particularly hard on low-income black families.",0,1,0
Most of the Democratic presidential candidates have prioritized tackling the nation’s staggering student debt crisis and many have called for some form of debt forgiveness.,0,1,0
"When parents borrow, the debt can weigh down families for generations but the burden falls particularly hard on low-income black families.",0,1,0
"Americans are carrying $1.57 trillion in outstanding student loan debt, more than what they owe on their credit cards.",0,1,0
"Opposition Labour Party leader Jeremy Corbyn said on Thursday he would look at ways to help those who have already incurred large debts from university tuition fees, and would not sell off student loans to private companies.",0,1,0
"Throughout her year-long presidential campaign, Warren has emphasized affordable college tuition as a way to reduce economic and racial inequality. In April, she rolled out a comprehensive plan to cancel $50,000 in student loan debt for borrowers with annual household incomes below $100,000, with some cancellation for those with household incomes between $100,000 and $250,000.",0,1,0
"Americans are carrying $1.57 trillion in outstanding student loan debt, more than what they owe on their credit cards.",0,1,0
"Warren last year introduced a proposal that would eliminate up to $50,000 in student loan debt for every indebted person with a household income of less than $100,000. ",0,1,0
"Warren would forgive up to $50,000 for each individual earning less than $100,000, which would dramatically impact Americans with undergraduate degrees, but likely only make a small dent for Americans with graduate degrees.",0,1,0
President Donald Trump on Friday announced that he has waived interest payments on all federal student loans to help alleviate financial strain as the United States combats the spread of the coronavirus.,0,0,1
"He then went on to endorse proposals by Omar, Sen. Bernie Sanders (I-VT), and other far-left legislators looking to make college tuition-free.",0,0,1
"At the time, Moynihan was primarily concerned that irresponsible politicians promising their constituents an insupportable array of handouts would jeopardize America’s economic well-being. ",0,0,1
"Republicans should stop fighting amnesty, President Obama said on Thursday, because one day a Hispanic will become president.",0,0,1
"Americans Need To Stop Hurrying Young People Into Student Debt Slavery. Above all, we must give high schoolers personalized post-secondary educational recommendations before they get caught in the quagmire of student debt.",0,0,1
"That Sanders’ proposal lacks any sort of means-testing requirement makes it clear that he believes this is something all people deserve, but it’s unclear why, or how that’s a worthwhile investment given that it will be allocated toward those who are relatively rich (or could have been relatively rich had they not gotten a useless master’s degree that doesn’t translate into higher earnings). ",0,0,1
Breitbart News reported last week on a viral video in which a father confronted presidential candidate Elizabeth Warren over her proposal to erase student loan debt.,0,0,1
"Next came the sob stories. Those student loans are suffocating a generation, the candidates suggested. After all, “40 million of us who can’t start a family,” the diaper-changing daddy Swalwell contradictorily proclaimed, adding that they “Can’t take a good idea and start a business and can’t buy our first home.”",0,0,1
" Gautney consented to this field, job, and city, so if she has an issue with compensation or cost of living, switching to a more lucrative field or cheaper place to live is a decision she should make for herself, not a decision that ought to be bailed out by unsuspecting taxpayers who played no role in the choice. ",0,0,1
U.S. Education Secretary Betsy DeVos is withdrawing protections put in place by former President Barack Obama for students who have mismanaged or are defaulting on their college loans.,0,0,1
"Some moderate Democrats have criticized that proposal, arguing that it would burden the wealthy and middle-class to help the working class, or that it would raise the national debt, which is currently $23 trillion.",0,0,1
"The other witnesses at the hearing shared story after story about how Americans are struggling to pay off student loans, with many having to delay getting married, buying a home, and having children.",0,0,1
"But if you major in philosophy or gender studies, you might struggle to find any job in your field, let alone a well-paying one.",0,0,1
The former administration presented itself as a protector of students against mistreatment by student loan companies that were seeking to collect debts owed and were accused of abusing student borrowers to pad their own profits,0,0,1
"Moynihan never described the specific spiritual benefits that would arise from the kind of cutbacks needed to solve a future government debt crisis. But in explaining how excessive public spending undermines traditional values, he was clearly suggesting subsequent belt-tightening could have the reverse effect.",0,0,1
"Though banks have fled many low-income communities, there’s a post office for almost every ZIP code in the country. ",1,0,0
"Ever since Democratic presidential candidate Sen. Elizabeth Warren (D-Mass.) revealed her plan to forgive student debt and make public universities free on Monday morning, the internet has been a carnival of bad faith, magical thinking and misinformation about the nature of college costs in the United States.",1,0,0
And one particularly radical idea is sure to grab the attention of young people around the country: wiping out student loan debt for the vast majority of American borrowers.,1,0,0
"Before we get to work dispensing these arguments, it’s important to acknowledge that they are, on some level, understandable. A lot of Americans, especially those who got their bachelor’s degree before the early 2000s, find it baffling that younger generations can’t work their way through college.",1,0,0
"Smith’s announcement Sunday at the all-male, historically black college in Atlanta, Georgia provoked impassioned calls for both making higher education free across the country and canceling student debt.",1,0,0
"Earlier this year, Freedom to Prosper and Data for Progress fielded a nationally representative survey analyzing support for repealing Trump’s tax cuts and using the proceeds to cancel outstanding student debt.",1,0,0
"Take the case of non-Hodgkin’s lymphoma survivor Chris Gonzalez; after being laid off by Goldman Sachs, the federal government gave him some relief by suspending his federal student loan payments. New Jersey, on the other hand, sued him and proceeded to snap up a state tax refund he was counting on.",1,0,0
"That statement, while true, could leave some listeners with the wrong impression. Warren’s plan would cancel at least some student debt for 95 percent of debt holders, and all debt for 75 percent of borrowers (the source of Vice’s erroneous headline).",1,0,0
"The administration has stonewalled Congress during the impeachment proceedings and other investigations, but the American public overwhelmingly wants the Trump administration to comply with lawmakers.",1,0,0
We should expect growing support for this item for a few reasons: Younger voters of all political stripes are being exposed to the status quo student loan system. Younger voters are also less likely to accept the toxic brand of “conservatism.” ,1,0,0
Anyone who has shouldered the burden of six-figure student loan debt knows the heavy toll it can take. ,1,0,0
"There may be pushback among Democrats. If so, I hope the ones doing the pushing will reconsider. We have treated our younger generations, and many older people, unjustly. The act of recognizing an injustice we hadn’t seen before makes us more human and refines us as moral beings.",1,0,0
"Minhaj, who used to appear on “The Daily Show” before getting his own Netflix series, “Patriot Act,” last year, aired an episode in February in which he broke down the often confusing but debilitating problem of crushing student loan debt in the United States.",1,0,0
"Earlier this year, Freedom to Prosper and Data for Progress fielded a nationally representative survey analyzing support for repealing Trump’s tax cuts and using the proceeds to cancel outstanding student debt.",1,0,0
"Before we get to work dispensing these arguments, it’s important to acknowledge that they are, on some level, understandable. A lot of Americans, especially those who got their bachelor’s degree before the early 2000s, find it baffling that younger generations can’t work their way through college.",1,0,0
"In the spring, the Trump administration’s Department of Health and Human Services unveiled a new policy designed to silence taxpayer-funded family planning clinics, preventing them from letting patients know about their abortion rights.",1,0,0
"Last year, some states tried to ban abortion after just six weeks into a pregnancy ― when many women don’t even know they’re pregnant yet. Considering that 1 in 4 women has an abortion during her lifetime, the effects of these restrictions could prove devastating.",1,0,0
But opponents argued that asking minors to negotiate the legal system when they are already scared and ashamed could drive them to illegal abortions.,1,0,0
Racist Rep. Steve King (R-Iowa) said generations of people would not be here without rape and incest while making the case for anti-abortion legislation without exceptions for victims of those crimes.,1,0,0
Her proposal brings into sharp focus conservatives’ crusade to legislate control of women’s bodies through restrictive abortion bills and other measures that undermine reproductive rights.,1,0,0
"Since Roe v. Wade, when the Supreme Court recognized the constitutional right to an abortion, state lawmakers have devised novel ways to cut off access to the procedure without banning it outright. One strategy is to require clinics and doctors to comply with an ever-expanding list of regulations, with the goal of essentially red-taping providers out of business.",1,0,0
The specter of “abortion regret” has been used by lawmakers and judges alike to impose or uphold rules making it harder for people to get abortions.,1,0,0
Lawmakers who claim to care about women’s emotional health would do better to listen to the hundreds of thousands of women who seek abortion care every year and know it is the right decision.,1,0,0
"Ohio's Down syndrome abortion ban and similar proposals around the country have triggered emotional debate over women’s rights, parental love, and the trust between doctor and patient.",1,0,0
The votes come as a new conservative majority on the nation’s highest court has made abortion rights supporters nervous. ,1,0,0
"Trump likes to tell this story with vivid and completely made-up details about swaddling a baby in blankets before murdering it. The Senate held hearings in which anti-choice activist Jill Stanek — a crazed, racist liar who also claims Chinese people think aborted fetuses are a “delicacy” — claimed, almost certainly falsely, that she once witnessed a baby being killed this way. ",1,0,0
"There was a point a few years ago at which some GOP officials, fearing a backlash in response to the “war on women,” pretended to be pro-choice and used highly deceptive rhetoric about contraception as a way to improve their electoral prospects.",1,0,0
"In an era in which domestic terrorism is an increasingly deadly societal scourge, it’s dangerous when a sitting American president lies to rabid followers with tales of infants being executed in medical facilities.",1,0,0
"Protecting pregnant women, new mothers and children is about more than scoring political points with anti-choice legislation.",1,0,0
Racist Rep. Steve King (R-Iowa) said generations of people would not be here without rape and incest while making the case for anti-abortion legislation without exceptions for victims of those crimes.,1,0,0
Practicing pro-life litigators know that Trump judges are saving lives by permitting restrictions on abortion to go into effect.,0,0,1
"Sen. Steve Daines, a Republican from Montana, announced during the March for Life rally Friday that he has launched the first pro-life caucus in the U.S. Senate.",0,0,1
"The number of abortions performed in 2017-2018 was 11,373 more than the abortions performed the year before that, a trend that shows that while Planned Parenthood officials once said abortion should be “safe, legal, and rare,” today they omit the word “rare” in their mantra as they perform more abortions each year.",0,0,1
"Abortionists, who prey on desperate people, should no longer receive your hard-earned tax dollars.",0,0,1
"According to Planned Parenthood office in Roanoke, Virginia, the abortion giant will continue to perform abortion services during the COVID-19 pandemic, claiming abortion is an “essential” medical service.",0,0,1
"Having a baby is hard, caring for a baby is hard, going back to work after a leave is hard but a few weeks of salary is not worth killing your baby for.",0,0,1
It’s also why attempts to portray pro-lifers as racists smack of disingenuousness.,0,0,1
The argument that the real way to end abortion is to make abortion unnecessary by establishing a generous cradle-to-grave welfare state salves left-wing Christians' consciences for their support of radically pro-abortion politicians like Sen. Bernie Sanders.,0,0,1
"Despite the image portrayed of popular culture in the media, of those Millennials surveyed, only seven percent supported abortion without any exceptions and funded by taxpayer dollars — the position embraced by the Democrat Party.",0,0,1
"Abortion propaganda was always meant to obscure the reality of abortion, not justify it.",0,0,1
"Franciscan friar Father Daniel Horan, a pro-LGBT priest and professor who will be speaking at the upcoming Los Angeles Religious Education Congress, took to Twitter this weekend to bash the March for Life and condemn without trial a group of white Catholic high school boys as “racists” for supposedly “taunting” a Native American man beating a drum.",0,0,1
"Why did Democrats vote overwhelmingly against a bill that would require infants born alive after abortion to be treated as any other infant born at that gestational age? Because abortion is the right to destroy one’s own child, and if a woman chose to kill her baby, to the left it would seem a violation of her so-called right to choose for doctors to try to save that baby.",0,0,1
"Netflix's statements related to leaving Georgia if fetal heartbeat law goes into effect is the company’s way of firing a warning shot to Georgia and similar states: Conform to our Hollywood ideals and values, or we won’t give you our business.",0,0,1
This argument that the real way to end abortion is to make abortion unnecessary by establishing a generous cradle-to-grave welfare state is also an extension of the dishonest taunt that conservative Christians only care about babies before they’re born.,0,0,1
Letters from GOP members of Congress and national pro-life leaders to the White House and the Food and Drug Administration (FDA) last week asserted Democrats are attempting to exploit the coronavirus pandemic for the purpose of advancing their party’s pro-abortion agenda.,0,0,1
"In New York, a mother-to-be faces childbirth without her husband, in Texas, hundreds of women seeking abortions are turned away, across the country, women are facing postponed mammograms and devastated by suspended fertility treatments.",0,1,0
"A divided federal appeals court on Tuesday rejected Planned Parenthood’s constitutional challenge to an Ohio law depriving the organization of state funding because it performs abortions, handing a victory to anti-abortion advocates.",0,1,0
"A divided federal appeals court on Tuesday rejected Planned Parenthood’s constitutional challenge to an Ohio law depriving the organization of state funding because it performs abortions, handing a victory to anti-abortion advocates.",0,1,0
"Federal judges on Monday blocked officials in Texas, Ohio and Alabama from curbing most abortions in those states as part of their orders to postpone surgeries and other procedures deemed not medically necessary during the coronavirus crisis.",0,1,0
"Even so, the results offer fresh evidence that concerns about women’s emotional health after an abortion shouldn’t factor into policies about legal access to these procedures, said Julia Steinberg, a researcher at the University of Maryland, College Park, who wasn’t involved in the study.",0,1,0
"In a part of the country where the rules about who can access abortion care vary dramatically from state to state, the COVID-19 pandemic has sewn another layer of confusion.",0,1,0
There is no evidence to support the allegation Pelosi was trying to include abortion funding in the coronavirus emergency bill as the Facebook post claims.,0,1,0
"After Dr. Ulrich Klopfer died in rural Crete, Illinois, on Sept. 3, authorities found ""2,246 medically preserved fetal remains"" in his home. ",0,1,0
"More than 400 women have applied to attend a candidate training session this weekend in Washington hosted by Emily’s List, an organization that works to elect women who support abortion rights, said spokeswoman Tonya Williams.",0,1,0
"Though the indictment of a woman for her own pregnancy loss is unusual in Alabama, it is not unusual for prosecutors to charge people with murder even if they never killed anyone. ",0,1,0
"Federal judges on Monday blocked officials in Texas, Ohio and Alabama from curbing most abortions in those states as part of their orders to postpone surgeries and other procedures deemed not medically necessary during the coronavirus crisis.",0,1,0
"The U.S. Supreme Court on Friday temporarily prevented a Louisiana law imposing strict regulations on abortion clinics from taking effect in a case that presents a key test on the contentious issue following last year’s retirement of Justice Anthony Kennedy, a pivotal supporter of abortion rights.",0,1,0
The law is one of the most restrictive in the United States and activists say it effectively forbids most abortions since many women do not know they are pregnant yet at eight weeks.,0,1,0
"Gov. Tate Reeves, who has worked for years to limit and end abortion in Mississippi, promised to take action against the state's lone abortion clinic if it continues to provide abortions during the coronavirus pandemic.",0,1,0
An hourlong oral argument Wednesday inside the Supreme Court could go a long way toward reversing abortion rights in the USA. ,0,1,0
But the fact that Trump cloaks this fact by stoking false fears about immigrant crime and delivering rage-filled rants about “illegal” immigration shows that this isn’t some genuine and reasoned policy view about the costs and benefits of new entrants to the labor force — it’s a reactionary stance built atop anti-immigrant bigotry.,1,0,0
"U.S. Rep. Steve King, under fire for defending white nationalism and white supremacism is now endorsing President Trump’s desire to declare a national emergency to build his wall.",1,0,0
"The Republican president proceeded to pitch an aggressively anti-immigrant message ahead of Election Day 2018, when voters handed Democrats control of the House.",1,0,0
