text,is_left,is_center,is_right
House and Senate Democrats are responding to the coronavirus outbreak in the United States by supporting measures to effectively strip President Trump of his authority to impose travel bans to protect American citizens.,0,0,1
Democrats blocked a coronavirus package on Sunday that would provide economic relief to businesses and Americans suffering from the impact of the coronavirus outbreak,0,0,1
The deepening economic crisis triggered by nationwide lockdowns to slow the spread of the novel coronavirus was underscored by other data on Thursday showing worker productivity fell at its fastest pace in more than four years in the first quarter amid the largest drop in hours since 2009.,0,1,0
"President Donald Trump's top health advisers – Anthony Fauci and Deborah Birx – showed up at a White House event Friday with protective masks, though the president himself continued to spurn any kind of face covering.",0,1,0
"Trump wants the country to reopen and restrictions imposed by states and local governments to control the spread of COVID-19, the respiratory illness caused by the virus, eased.",0,1,0
"U.S. President Donald Trump is open to negotiations on another possible stimulus bill amid the novel coronavirus pandemic, but not the one put forward by House of Representatives Democrats, a White House spokeswoman said on Thursday.",0,1,0
Wall Street surged on Thursday as investors weighed the prospect of economic recovery against bellicose remarks from President Donald Trump regarding U.S.-China trade and a whistleblower’s dire warnings about the U.S. response to the coronavirus pandemic.,0,1,0
"There is a growing push within the Trump administration to craft a list of retaliatory measures against China over its role in the coronavirus outbreak, three sources, including a U.S. official, familiar with the matter said, but cautioned the efforts were in early stages.",0,1,0
"That damage was in evidence in a report from the U.S. Labor Department, which showed just under 3 million new jobless claims last week, pushing the seven-week tally well over 36 million.",0,1,0
United Airlines said Tuesday it would suspend 24 flights between the U.S. and China the first week of February amid growing concern about the spread of the coronavirus that originated in the Asian nation.,0,1,0
"As the COVID-19 virus spreads in the USA and around the world, officials at the U.S. Centers for Disease Control and Prevention encourage people to work from home as a way to help cut back contagion.",0,1,0
Wall Street surged on Thursday as investors weighed the prospect of economic recovery against bellicose remarks from President Donald Trump regarding U.S.-China trade and a whistleblower’s dire warnings about the U.S. response to the coronavirus pandemic.,0,1,0
"Mafia exploitation of immigrants on farms in Italy is likely to rise as the coronavirus lockdown brings chronic labor shortages, the government and labor rights groups have warned.",0,1,0
"U.S. President Donald Trump is open to negotiations on another possible stimulus bill amid the novel coronavirus pandemic, but not the one put forward by House of Representatives Democrats, a White House spokeswoman said on Thursday.",0,1,0
"President Donald Trump's top health advisers – Anthony Fauci and Deborah Birx – showed up at a White House event Friday with protective masks, though the president himself continued to spurn any kind of face covering.",0,1,0
"Malaysia’s health ministry called on Thursday for mass gatherings to be postponed after at least 12 coronavirus cases were linked to a three-day religious event in the capital attended by some 10,000 people from several countries.",0,1,0
"Trump wants the country to reopen and restrictions imposed by states and local governments to control the spread of COVID-19, the respiratory illness caused by the virus, eased.",0,1,0
"President Donald Trump said Friday he has drawn historic lessons from an unusual source, none other than Richard Nixon – but then he quickly argued he hasn't followed all the examples of the only U.S. president to be forced to resign his office.",0,1,0
"U.S. President Donald Trump said on Tuesday he backed Bolivia’s interim President Jeanine Anez as she seeks “a peaceful democratic transition,” and he denounced ongoing violence in the country.",0,1,0
"President Donald Trump offered condolences to the family of Ahmaud Arbery, a 25-year-old black man in Georgia who was killed after being pursued by two armed white men while he was jogging. Trump said he'll receive ""a full report"" this evening. ",0,1,0
"The impeachment trial of President Donald Trump begins in earnest in the U.S. Senate on Tuesday, after he was formally charged by the Democratic-controlled House of Representatives on Dec. 18 with “high crimes and misdemeanors.”",0,1,0
"But the president's ""ask China"" response is reflective a larger strategy to deflect any blame for administration's handling of the pandemic onto China, a chief U.S. rival and the place where the outbreak began. ",0,1,0
"Trump on Sunday retweeted a former Republican congressional candidate’s tweet that was critical of comments Fauci made in a CNN interview and contained a call for his firing. Fauci, 79, has been director of the National Institute of Allergy and Infectious Diseases since 1984.",0,1,0
"Trump on Sunday retweeted a former Republican congressional candidate’s tweet that was critical of comments Fauci made in a CNN interview and contained a call for his firing. Fauci, 79, has been director of the National Institute of Allergy and Infectious Diseases since 1984.",0,1,0
Trump seemed perturbed by the three reporters' willingness to cooperate by allowing their colleagues to finish their question even as the president tried to move on. ,0,1,0
"President Donald Trump abruptly turned and walked away from the lectern at a White House news briefing Monday after telling a reporter to ""ask China"" in response to a question about U.S. coronavirus testing capacity. ",0,1,0
"Trump's latest thinking on the task force, created in January to coordinate the response to the virus, came a day after Vice President Mike Pence and other officials said the group's work would be transferred to federal agencies as soon as this month. The idea drew fire from critics who said it was too soon to disband the group.",0,1,0
The Trump administration shelved a document created by the nation's top disease investigators with step-by-step advice to local authorities on how and when to reopen restaurants and other public places during the still-raging coronavirus outbreak,0,1,0
"U.S. President Donald Trump said on Tuesday he backed Bolivia’s interim President Jeanine Anez as she seeks “a peaceful democratic transition,” and he denounced ongoing violence in the country.",0,1,0
"Trump, who denied accusations that he fired Comey in an effort to cover up alleged cooperation between his campaign and the Russians, also said Friday Nixon made a mistake in firing a number of aides who wound up providing evidence against him.",0,1,0
"But the president's ""ask China"" response is reflective a larger strategy to deflect any blame for administration's handling of the pandemic onto China, a chief U.S. rival and the place where the outbreak began. ",0,1,0
"The resolution, which the House had approved in March, marked a rare bipartisan effort to curb Trump's powers and underscored lingering concerns among some lawmakers that tensions with Tehran could escalate into a war. Supporters have acknowledged they do not have enough support to override Trump's veto, the seventh of his presidency.  ",0,1,0
"During the campaign, it was clear that much of the momentum behind NeverTrump was driven by narcissism, as well as by self-interest. NeverTrump gambled on a Hillary Clinton victory, preparing to blame Trump supporters and hoping to take revenge.",0,0,1
"But the president kept his word when it came to the Court. It’s still early in the Trump era, of course, and we really have no idea how the residual political effects of our acute partisan battles or investigations or ugly rhetoric or the often-incompetent presidency will manifest in the long term.",0,0,1
"Donald Trump’s victory last November was not just a repudiation of the Democrat Party and Hillary Clinton. No, 2016 was a revolt against the entire Washington establishment, both on the left and the right. Don’t forget, Trump blew away everyone in the Republican primary too, from accomplished governors to Jeb Bush (R) from Tea Party darlings to washed up Senators. Trump wiped the floor with them.",0,0,1
"As we got into the cab, our tow truck driver, a middle-aged man from Brooklyn, wasted only a few minutes before bringing up Trump with missionary zeal. He told us that he hated politics and hated politicians, but loved Donald Trump. Why? Because Trump is the only one speaking up for people like him.",0,0,1
"Trump is nothing if not a public relations savant. Once the dust settles, if he cannot take credit for restoring order, he’ll do his best to deflect and lay the blame at someone else’s feet. He’ll remind his followers what the other side thinks of them, how they desecrated our American values, and what will happen to them if Joe Biden becomes the apologizer-in-chief.",0,0,1
"It’s not a huge deal that an eccentric, pro-Trump activist clumsily used a bad analogy in a local speech. The analogy is bad enough, however, that it certainly shouldn’t be on the president’s Twitter feed.",0,0,1
"The two men are known to be friendly and frequently golf together at Mar-a-lago. But apart from their friendship, Trump should feel a great bond with Limbaugh. After all, without his three decades of on-air bombast, bluster, and fearless defense of his audience, there likely would not be a President Trump.",0,0,1
"On this episode of the Federalist Radio Hour, Garett shares his experiences covering politics, how television and print media have changed, and his own account of the first year of the Trump presidency.",0,0,1
"As we got into the cab, our tow truck driver, a middle-aged man from Brooklyn, wasted only a few minutes before bringing up Trump with missionary zeal. He told us that he hated politics and hated politicians, but loved Donald Trump. Why? Because Trump is the only one speaking up for people like him.",0,0,1
"Even if Trump is “unraveling” as Never Trumpers are wont to claim, his supporters won’t disappear on November 4th. George Will and the leftists many Never Trumpers now ally themselves with must reconcile their perception of the American people with reality.",0,0,1
"As dear leader Mitch McConnell (R-Ky.) is fond of saying, “winners make policy, losers go home.” And yet unfortunately, Republicans in the Senate refuse to take the phrase to heart. Which is a real shame. We are just under 280 days into the Trump presidency, yet beyond nominations, Congress has made almost no progress passing the agenda America elected them to enact.",0,0,1
"Trump is nothing if not a public relations savant. Once the dust settles, if he cannot take credit for restoring order, he’ll do his best to deflect and lay the blame at someone else’s feet. He’ll remind his followers what the other side thinks of them, how they desecrated our American values, and what will happen to them if Joe Biden becomes the apologizer-in-chief.",0,0,1
"But the president kept his word when it came to the Court. It’s still early in the Trump era, of course, and we really have no idea how the residual political effects of our acute partisan battles or investigations or ugly rhetoric or the often-incompetent presidency will manifest in the long term.",0,0,1
"The biggest problem for NeverTrump, however, is the pitiful performance of the Republican Congress, which has been unable to act on its core priorities, and reinforces the notion that only Trump is strong enough to lead the party.",0,0,1
"The movement known as NeverTrump — self-identified conservatives who vowed never to vote for Donald Trump, even at the price of a Hillary Clinton presidency and liberal dominance of the Supreme Court for generations — did not take long to recover from the shock of Trump’s victory in November.",0,0,1
"Whatever the specifics of what Donald Trump’s diagnosis may be, from the moment protesters started to hit the streets to denounce police brutality, one thing was certain: The president’s brainworms would direct his energies away from doing anything useful and toward the task of managing his ego, relying on the reality TV tricks he mistakes for the real work of presidenting.",1,0,0
"The startling, aggressive attacks on peaceful protesters by the National Guard occurred after a “pointed threat” from the Pentagon that if the Guard couldn’t handle the situation, active-duty military units would be sent to deal with civilians, the Times reported.",1,0,0
"Even Richard Nixon, to whom Trump likes to compares himself to, was occasionally willing to venture out into crowds of protesters to talk to them. Trump, however, is such a wuss that he made his cadre of protectors tear-gas people rather than subject himself to a crowd’s insults. Far from proving he was a tough guy, Trump’s actions only led to another round of taunting about his wimpiness.",1,0,0
"When he finally spoke in the Rose Garden on Monday, Trump threatened to deploy the military against American citizens if the governors didn’t take his advice for a more forceful crackdown. This threat didn’t appear to cow anyone, and only increased the anger. ",1,0,0
The Never Trumper Republicans of The Lincoln Project have mobilized former Defense Secretary Jim Mattis’s scathing broadside against the president in their latest attack on Donald Trump.,1,0,0
"Trump’s profound megalomania, impulsiveness, and defective character is what got us where we are today. If we are to have any shot at a real recovery, he needs to go.",1,0,0
"There is no way to fling the footage into the Trash folder, or to edit the crap out of it until it sends the “right” message. Trump’s continued demands that the world act like a reality-show producer who can keep giving him mulligans only reaffirms that he is, above all things, a narcissistic moron.",1,0,0
Trump proceeded to ignore multiple other attempts made over subsequent weeks by his advisers and Republican allies to get him to take the pandemic seriously. Instead he dismissed their warnings as “alarmist” and would go on to hold a number of rallies (seven) and golfing outings (three) between learning of Obama’s pandemic playbook and ultimately declaring a national emergency.,1,0,0
"Trump has also in his years in the White House frequently praised the use of violence. He told police officers in 2017 that they shouldn’t worry about hitting suspects’ heads as they place them in patrol cars. And on a conference call with governors on Monday, he berated them for not “dominating” the streets of their cities.",1,0,0
"Former Australia Prime Minister Kevin Rudd ripped Donald Trump’s botched handling of the coronavirus pandemic in a new op-ed, describing the U.S. president as a “quack apothecary” for hyping unproven cures",1,0,0
"Trump’s profound megalomania, impulsiveness, and defective character is what got us where we are today. If we are to have any shot at a real recovery, he needs to go.",1,0,0
"Trump wore no face mask nor any other protective gear, which is typical for him, despite recommendations to the contrary by the Centers for Disease Control and Prevention. He stopped to talk to employees — who were wearing white lab coats, masks, gloves, goggles, hair coverings and plastic booties — while they were working with the sterile swabs.",1,0,0
"Donald Trump is not an ideas man. This has been a defining feature of his presidency. He’s not a learned policy wonk, understanding the complex nuances of law and governance. He is, at his core, just a former game show host and a con man.",1,0,0
"Many pointed out at the time of the Park Police’s first statement denying use of “tear gas” was obviously misleading. But Trump and his right-wing defenders jumped on it. Most prominently, Federalist writer Mollie Hemingway wrote a piece, shared by the president, accusing the media of falsely reporting that tear gas was used, even though the crowd was exposed to gases and compounds that clearly caused tears and severe irritation.",1,0,0
"Nevertheless, Trump and other Republicans have tarred the protests as havens for terrorists intent on destroying property. ",1,0,0
"In a series of early morning tweets on July 26, 2017, that reportedly took the Department of Defense by surprise, President Donald Trump announced that he was reinstating the repealed ban on transgender military service.",1,0,0
Closing the gender pay gap is not rocket science – even though recently graduated female rocket scientists earn 89 cents on the dollar to their male peers.,1,0,0
"Since then, drip by drip, other parts of the federal government have had their online content trimmed to omit mention of lesbian, gay, bisexual, transgender and queer people.",1,0,0
Polling for the Democratic nomination tells a depressing story for those seeking to break the glass ceiling and make the ultimate stand against patriarchy: the top contenders for the Democratic nomination are currently all white men.,1,0,0
"The fact that many Democratic women are no longer convinced that a woman can beat Trump, and are supporting white men for reasons of electability, is a tragedy. ",1,0,0
"Few could have anticipated that the historic release of the first image of a black hole would devolve into a public spectacle of sexist outrage — though such are the times we live in, in which literally every news item is picked apart by reactionaries.",1,0,0
"At least 25 transgender or gender-nonconforming people were killed in violent attacks in the United States last year, according to the Human Rights Campaign, which has been tracking anti-trans violence since at least 2015.",1,0,0
"In a series of early morning tweets on July 26, 2017, that reportedly took the Department of Defense by surprise, President Donald Trump announced that he was reinstating the repealed ban on transgender military service.",1,0,0
"The message from the Bouman backlash is that if you are a woman who becomes the face of a massive scientific breakthrough, sexist internet trolls will spend way too much of their time harassing you and trying to disprove your credibility.",1,0,0
"The figure of 78 cents to a man’s dollar is familiar to many of us: for each dollar that men earn, women earn 78 cents.",1,0,0
Polling for the Democratic nomination tells a depressing story for those seeking to break the glass ceiling and make the ultimate stand against patriarchy: the top contenders for the Democratic nomination are currently all white men.,1,0,0
"Many people in politics and media are still not used to female power, and Pelosi’s novel position, while creating some pointless problems for her, also gives her some surprising advantages.",1,0,0
A bill proposed by a group of Republican lawmakers on Wednesday that would have amended the Iowa Civil Rights Act by removing protections against discrimination for transgender people is dead,1,0,0
"In Tuesday night's debate, the two progressive senators de-escalated a tense round of tit-for-tat exchanges between their presidential campaigns over the charged issues of gender and electability.",1,0,0
"While Americans still cling to sexist gender roles at home, overwhelming majorities believe that sex discrimination in public spaces should be illegal.",1,0,0
"Populist Interior Minister Matteo Salvini has slammed Saudi Arabia, the host of the Italian football Super Cup, for not allowing single women to attend the match without a man accompanying them.",0,0,1
"All but seven House Democrats voted Friday for a bill which ends legal and civic rights for women by allowing men who say they are transgender to freely use women’s legal rights, sports leagues, institutions, and private spaces.",0,0,1
"Democrat presidential candidate Joe Biden urged members of the U.S. Women’s National Soccer team to keep fighting for equal pay, after a judge threw out their lawsuit claiming discrimination.",0,0,1
"Despite Portman’s insistence that she has tried to advance female directors, only one of her feature films was directed by a female.",0,0,1
"Polls show the transgender ideology is deeply unpopular, especially among women and parents.",0,0,1
"University of Texas at Austin student Sanika Nayak argued that men make gym facilities uncomfortable for women and proposed that the University of Texas should divide the gym into protected sections, so that female students can feel more comfortable when they are exercising.",0,0,1
"In addition to mocking Ivanka for her looks, the exhibit that invites people to throw trash at vacuuming Ivanka Trump lookalike demeans the First Daughter’s success as a business woman and White House advisor to that of a woman with a vacuum—as if something’s wrong with that, too. ",0,0,1
"Cancellation of a two-week United Nations meeting on gender equality, female empowerment and “women’s issues” due to the coronavirus outbreak sparked an outcry from 12,000 disappointed delegates, diplomats and non-government organizations scheduled to fly into New York for the event and work towards ending “default male thinking” across the globalist organization.",0,0,1
"Female genital mutilation is illegal in Germany, leading many families to travel to their country of origin to have the gruesome ritual performed on their daughters.",0,0,1
The transgender effort to suppress any recognition that men and women are different and complementary would not matter except for the movement’s political alliance with wealthy progressives and radical feminists who wish to destroy the political power of the male-and-female family.,0,0,1
"Female genital mutilation is illegal in Germany, leading many families to travel to their country of origin to have the gruesome ritual performed on their daughters.",0,0,1
"The irony, of course, is that the exhibit that invites people to throw trash at vacuuming Ivanka Trump lookalike reflects every stereotype feminists claim to stand against, oversexualizing Ivanka’s body and ignoring her hard work.",0,0,1
"Surprising because in its early trailer, FX’s Anti-Phyllis Schlafly Series Mrs. America sold itself as a celebration of second-wave feminism as it waged righteous war against the dark forces of the “patriarchy.”",0,0,1
Victoria’s Secret chose the middle of a worldwide pandemic to launch its spring campaign featuring transgender and plus-sized models. ,0,0,1
"For the latest grisly example of hypocrisy, “progressive” cronyism, feminist cry-bullying, and Deep State entrenchment, look no further than Britain’s Chief Medical Officer Dame Sally Davies.",0,0,1
Harris had also planned to take time during her Iowa visit to talk about her new policy proposal aimed at closing the gender pay gap.,0,1,0
Boodsabann Chanthawong recently joined a growing number of women defying generations of Thai Buddhist tradition by becoming ordained as novice monks at an unrecognized all-female monastery outside Bangkok.,0,1,0
The 2016 election of Donald Trump as president so outraged large groups of women that they protested against him in record numbers the day after his inauguration.,0,1,0
"The biggest swimming pool in Russia’s Muslim-majority North Caucasus region has banned women, prompting anger from rights activists and others who have accused the sports complex of discrimination.",0,1,0
Elizabeth Banks pointed out that knowing what other women and men are making in Hollywood is essential to making pay equitable across gender lines. ,0,1,0
"Two years after filling the streets of U.S. cities to protest the start of Donald Trump’s presidency, women will march again this weekend to try to build political pressure against him ahead of the 2020 elections.",0,1,0
"A Gallup poll reports that women are still more likely to do laundry, clean the house, do grocery shopping, prepare meals, wash dishes and make decisions about furniture and decorations – even among younger generations who are reportedly more egalitarian as ever.",0,1,0
"Bloomberg did not reference specific jokes. ABC News reported in December that it obtained a copy of a 32-page booklet distributed at a party in 1990 that included sexist remarks by Bloomberg, reportedly compiled by his colleagues.",0,1,0
"Democrats and Republicans stood and applauded after Illinois Rep. Rodney Davis, the top Republican on the House Administration Committee, saluted Haaland for making history as the first Native American woman to preside over the chamber.",0,1,0
Swiss voters will head to the polls to decide whether homophobia – hate crimes or discrimination based on sexual orientation –should be criminalized.,0,1,0
"An organization backed by Saudi Arabia accused several foreign countries of inciting young women to reject their families, the first public comments from Riyadh since a woman claiming domestic abuse was granted asylum in Canada over the weekend.",0,1,0
Apple and Google are facing criticism for offering an app that lets men in Saudi Arabia track and control the movement of women.,0,1,0
"Campaigners for gender equality took to European city streets on Friday to mark International Women’s Day with celebrations and protests, while in Turkey police fired tear gas to break up a crowd of several thousand women in Istanbul in the evening.",0,1,0
"Dogging Bloomberg’s campaign are allegations that he made inappropriate comments toward women and that his company, Bloomberg LP, fostered a hostile environment for female employees.",0,1,0
